{
  "$schema": "http://json-schema.org/draft-07/schema#",
  "$id": "catalyx/schemas/sector_study.json",
  "schema_version": "1.4",
  "title": "SectorStudy",
  "description": "Bottom-up sector analysis, independent of active catalysts. The sector's 'fundamental file'. TWO REFRESH DEPTHS (schema 1.3): `core` is the cheap, decision-relevant refresh that the monthly review runs by default (~2 searches); `full` is the deep dossier, run on first study, before opening a position, or quarterly. See study_type.",
  "type": "object",
  "required": [
    "id",
    "schema_version",
    "sector_id",
    "sector_label",
    "created_at",
    "last_updated",
    "taxonomy",
    "risks"
  ],
  "properties": {
    "$schema": {
      "type": "string",
      "description": "Pointer to this schema file. Same convention as movement.json."
    },
    "id": {
      "type": "string",
      "pattern": "^study_[a-z0-9_]+$"
    },
    "schema_version": {
      "type": "string",
      "enum": [
        "1.2",
        "1.3",
        "1.4"
      ],
      "description": "1.4 adds the optional declined_catalyst_ids (older files read back unchanged). 1.3 adds study_type=core (cheap refresh) and deprecates etf_analysis. 1.2 files read back unchanged."
    },
    "sector_id": {
      "type": "string"
    },
    "sector_label": {
      "type": "string"
    },
    "created_at": {
      "type": "string",
      "format": "date"
    },
    "last_updated": {
      "type": "string",
      "format": "date"
    },
    "study_type": {
      "type": "string",
      "enum": [
        "core",
        "full",
        "summary",
        "watch_only"
      ],
      "default": "core",
      "description": "Refresh depth. `core` (1.3, the review default): ONLY the fields a decision or the scorers actually read — active_catalyst_ids, narrative_maturity + narrative_notes, cycle_position, key_metrics_to_monitor, risks, last_updated. ~3 KB, 2 WebSearches. `full`: the complete dossier, adding demand_drivers, supply_constraints, technology_maturity, historical_catalyst_performance — ~25 KB, 6 WebSearches; run on creation, before an open, or quarterly. `summary` is the pre-1.3 name for a partial study, kept for read-back. `watch_only` for non-investable sectors."
    },
    "taxonomy": {
      "type": "object",
      "required": [
        "parent_sector",
        "differentiation_note"
      ],
      "properties": {
        "parent_sector": {
          "type": "string"
        },
        "adjacent_sectors": {
          "type": "array",
          "items": {
            "type": "string"
          }
        },
        "differentiation_note": {
          "type": "string",
          "description": "Why this sector is distinct from adjacent sectors. The core of the granularity requirement."
        }
      }
    },
    "demand_drivers": {
      "type": "array",
      "minItems": 1,
      "items": {
        "type": "string"
      },
      "description": "Required only for study_type=full: the taxonomy's per-sector `demand_drivers` already carries the short version, so a core refresh does not re-derive it."
    },
    "supply_constraints": {
      "type": "array",
      "items": {
        "type": "string"
      }
    },
    "technology_maturity": {
      "type": [
        "object",
        "null"
      ],
      "description": "Only for deep_tech / futuristic sectors.",
      "properties": {
        "trl_level": {
          "type": "integer",
          "minimum": 1,
          "maximum": 9
        },
        "trl_description": {
          "type": "string"
        },
        "gartner_hype_cycle_position": {
          "type": "string",
          "enum": [
            "technology_trigger",
            "peak_of_inflated_expectations",
            "trough_of_disillusionment",
            "slope_of_enlightenment",
            "plateau_of_productivity"
          ]
        },
        "estimated_commercialization_horizon": {
          "type": "string"
        },
        "investability_note": {
          "type": "string"
        },
        "etf_proxy_quality": {
          "type": "string",
          "enum": [
            "good",
            "medium",
            "poor",
            "none"
          ]
        },
        "watch_triggers": {
          "type": "array",
          "items": {
            "type": "string"
          },
          "description": "Specific events that, when triggered, flag the sector as potentially investable."
        }
      }
    },
    "cycle_position": {
      "type": [
        "object",
        "null"
      ],
      "properties": {
        "assessment": {
          "type": "string"
        },
        "rationale": {
          "type": "string"
        },
        "last_assessed": {
          "type": "string",
          "format": "date"
        }
      }
    },
    "etf_analysis": {
      "type": "array",
      "items": {
        "type": "object",
        "required": [
          "ticker",
          "exchange",
          "currency",
          "ter",
          "aum_m_usd",
          "replication",
          "recommendation_tier"
        ],
        "properties": {
          "ticker": {
            "type": "string"
          },
          "name": {
            "type": "string"
          },
          "exchange": {
            "type": "string"
          },
          "currency": {
            "type": "string"
          },
          "ter": {
            "type": [
              "number",
              "null"
            ]
          },
          "aum_m_usd": {
            "type": [
              "number",
              "null"
            ]
          },
          "replication": {
            "type": [
              "string",
              "null"
            ],
            "enum": [
              "physical",
              "synthetic_swap",
              "optimized_sampling",
              null
            ]
          },
          "avg_spread_bps": {
            "type": [
              "number",
              "null"
            ]
          },
          "avg_daily_volume_m_usd": {
            "type": [
              "number",
              "null"
            ]
          },
          "top_10_concentration_pct": {
            "type": [
              "number",
              "null"
            ]
          },
          "characteristics": {
            "type": "string"
          },
          "recommendation_tier": {
            "type": "integer",
            "minimum": 1,
            "maximum": 3
          },
          "limitations": {
            "type": "string"
          }
        }
      },
      "deprecated": true,
      "description": "DEPRECATED (1.3): duplicated catalyx/config/etf_universe.yaml, which is the single source of truth for tickers/TER/AUM/UCITS/spread and the only one any code reads (`_primary_etf`). Kept readable for one major version per the Schema Change Protocol; do not populate it in new studies — cite etf_universe.yaml instead."
    },
    "key_metrics_to_monitor": {
      "type": "array",
      "items": {
        "type": "object",
        "required": [
          "metric",
          "source"
        ],
        "properties": {
          "metric": {
            "type": "string"
          },
          "unit": {
            "type": "string"
          },
          "source": {
            "type": "string"
          },
          "current": {
            "type": [
              "number",
              "string",
              "null"
            ]
          },
          "comment": {
            "type": "string"
          }
        }
      }
    },
    "active_catalyst_ids": {
      "type": "array",
      "items": {
        "type": "string"
      }
    },
    "declined_catalyst_ids": {
      "type": "array",
      "description": "1.4. Registered events that name this sector in affected_sectors but were deliberately NOT linked into active_catalyst_ids, each with the date and the reason. A question answered must stay answered: catalyst_audit's event_not_linked stops listing them. Append-only in spirit \u2014 never used to hide an event the study should carry.",
      "items": {
        "type": "object",
        "required": ["catalyst_id", "date", "reason"],
        "properties": {
          "catalyst_id": {"type": "string"},
          "date": {"type": "string", "pattern": "^\\d{4}-\\d{2}-\\d{2}$"},
          "reason": {"type": "string", "minLength": 5}
        },
        "additionalProperties": false
      }
    },
    "historical_catalyst_performance": {
      "type": [
        "object",
        "null"
      ],
      "properties": {
        "summary": {
          "type": "string"
        }
      },
      "additionalProperties": true
    },
    "risks": {
      "type": "array",
      "minItems": 1,
      "items": {
        "type": "string"
      }
    },
    "narrative_maturity": {
      "type": [
        "string",
        "null"
      ],
      "enum": [
        "ignored",
        "emerging",
        "mainstream",
        "crowded",
        "exhausted",
        null
      ],
      "description": "Categorical narrative saturation level. See scoring_weights.yaml narrative_maturity_levels for anchored criteria with observable examples. When multiple structural catalysts are active, use the MAXIMUM level (most mature/crowded catalyst dominates — crowding risk is set by the highest-exposure thesis). More stable than analyst_narrative_score (0-100) across LLM sessions."
    },
    "analyst_narrative_score": {
      "deprecated": true,
      "type": [
        "integer",
        "null"
      ],
      "minimum": 0,
      "maximum": 100,
      "description": "DEPRECATED v1.2 — replaced by narrative_maturity. Retained for backwards compatibility only. Do not use in new sector studies. Rough conversion: <25=ignored, 25-45=emerging, 45-70=mainstream, 70-85=crowded, >85=exhausted."
    },
    "narrative_trend": {
      "type": [
        "string",
        "null"
      ],
      "enum": [
        "increasing",
        "stable",
        "decreasing",
        null
      ]
    },
    "narrative_notes": {
      "type": "string"
    }
  },
  "additionalProperties": false,
  "allOf": [
    {
      "if": {
        "properties": {
          "study_type": {
            "const": "full"
          }
        },
        "required": [
          "study_type"
        ]
      },
      "then": {
        "required": [
          "demand_drivers",
          "etf_analysis"
        ]
      }
    }
  ],
  "patternProperties": {
    "^_": {
      "description": "Human annotation; ignored by all readers."
    }
  }
}
